{
  "version": "discord-agent-observed.v1",
  "mode": "live_planner",
  "generated_at": "2026-08-28T06:35:36.669545+00:00",
  "suite": "canonical",
  "model": "openrouter",
  "summary": {
    "scenarios": 1,
    "passed": 1,
    "failed": 0,
    "known_failures": 0
  },
  "metrics": {
    "total_elapsed_ms": 20662,
    "time_to_first_turn_ms": 14501,
    "parse_successes": 1,
    "parse_failures": 0,
    "parse_success_rate": 1.0,
    "provider_draft_failures": 1,
    "provider_draft_parse_failures": 0,
    "bad_plans": 1,
    "bad_plan_rate": 1.0,
    "production_failures": 0,
    "avg_latency_ms": 14497.0,
    "max_latency_ms": 14497,
    "estimated_cost_usd": null,
    "pricing_source": "official provider pricing docs; OpenAI org usage/cost API requires api.usage.read",
    "retries": 1
  },
  "scenarios": [
    {
      "id": "github_issue_search_001",
      "fixture_id": "github_issue_search_001",
      "status": "passed",
      "known_failure": null,
      "checks": [
        {
          "name": "status",
          "passed": true,
          "expected": "executed",
          "observed": "executed"
        },
        {
          "name": "intent",
          "passed": true,
          "expected": "search_github_issues",
          "observed": "search_github_issues"
        },
        {
          "name": "model_tier",
          "passed": true,
          "expected": "fast",
          "observed": "fast"
        },
        {
          "name": "requires_confirmation",
          "passed": true,
          "expected": false,
          "observed": false
        },
        {
          "name": "result_statuses",
          "passed": true,
          "expected": [
            "succeeded"
          ],
          "observed": [
            "succeeded"
          ]
        },
        {
          "name": "action_count",
          "passed": true,
          "expected": 1,
          "observed": 1
        },
        {
          "name": "actions[0].tool_name",
          "passed": true,
          "expected": "github_issue.search_issues",
          "observed": "github_issue.search_issues"
        },
        {
          "name": "actions[0].requires_confirmation",
          "passed": true,
          "expected": false,
          "observed": false
        },
        {
          "name": "actions[0].required_scopes",
          "passed": true,
          "expected": [
            "github:repository:member:read"
          ],
          "observed": [
            "github:repository:member:read"
          ]
        },
        {
          "name": "actions[0].arguments",
          "passed": true,
          "expected": {
            "query": "onboarding",
            "repository": "508-dev/508-workflows",
            "state": "open"
          },
          "observed": {
            "query": "onboarding",
            "repository": "508-dev/508-workflows",
            "state": "open"
          }
        }
      ],
      "observed": {
        "id": "github_issue_search_001",
        "fixture_id": "github_issue_search_001",
        "description": "Engineers can search GitHub issues in an allowed repository without confirmation.",
        "tags": [
          "weekly",
          "github",
          "read"
        ],
        "request_message": "Search GitHub issues matching onboarding in repo 508-dev/508-workflows",
        "status": "executed",
        "message": "Executed the approved agent plan.",
        "clarification_question": null,
        "intent": "search_github_issues",
        "model_tier": "fast",
        "model": {
          "tier": "fast",
          "model": "qwen/qwen3.8-flash",
          "base_url": "https://openrouter.ai/api/v1",
          "source_tier": "fast",
          "fallback_used": false
        },
        "latency_ms": 14497,
        "parse_success": true,
        "parse_error": null,
        "raw_model_output": "{\n  \"status\": \"planned\",\n  \"intent\": \"github_issue_search\",\n  \"clarification_question\": null,\n  \"actions\": [\n    {\n      \"tool_name\": \"github_issue.search_issues\",\n      \"arguments\": {\n        \"query\": \"onboarding\",\n        \"repository\": \"508-dev/508-workflows\",\n        \"state\": \"all\"\n      },\n      \"summary\": \"Search GitHub issues in 508-dev/508-workflows for \\\"onboarding\\\".\"\n    }\n  ]\n}",
        "token_usage": {
          "requests": 1,
          "input_tokens": 1330,
          "cached_input_tokens": 1024,
          "output_tokens": 532,
          "total_tokens": 1862
        },
        "estimated_cost_usd": null,
        "requires_confirmation": false,
        "actions": [
          {
            "tool_name": "github_issue.search_issues",
            "arguments": {
              "query": "onboarding",
              "repository": "508-dev/508-workflows",
              "state": "open"
            },
            "risk": "low",
            "requires_confirmation": false,
            "required_scopes": [
              "github:repository:member:read"
            ],
            "summary": "Search GitHub issues matching: onboarding"
          }
        ],
        "results": [
          {
            "tool_name": "github_issue.search_issues",
            "status": "succeeded",
            "result": {
              "issues": [
                {
                  "number": 42,
                  "title": "Improve onboarding search",
                  "html_url": "https://github.example/issues/42",
                  "state": "open"
                }
              ]
            },
            "error": null
          }
        ]
      },
      "provider_draft": {
        "status": "failed",
        "checks": [
          {
            "name": "provider_draft.parse_success",
            "passed": true,
            "expected": true,
            "observed": true
          },
          {
            "name": "provider_draft.status",
            "passed": true,
            "expected": "planned",
            "observed": "planned"
          },
          {
            "name": "provider_draft.intent",
            "passed": false,
            "expected": "search_github_issues",
            "observed": "github_issue_search"
          },
          {
            "name": "provider_draft.actions[0].schema_valid",
            "passed": true,
            "expected": true,
            "observed": true
          },
          {
            "name": "provider_draft.action_count",
            "passed": true,
            "expected": 1,
            "observed": 1
          },
          {
            "name": "provider_draft.actions[0].tool_name",
            "passed": true,
            "expected": "github_issue.search_issues",
            "observed": "github_issue.search_issues"
          },
          {
            "name": "provider_draft.actions[0].arguments",
            "passed": false,
            "expected": {
              "query": "onboarding",
              "repository": "508-dev/508-workflows",
              "state": "open"
            },
            "observed": {
              "query": "onboarding",
              "repository": "508-dev/508-workflows",
              "state": "all"
            }
          }
        ]
      }
    }
  ]
}
